{
  "schema": "luminous.cooperative-offer/v1",
  "metadata": {
    "offer_id": "fixture:eu:reusable-tote-001",
    "revision": 1,
    "status": "draft",
    "fixture_only": true
  },
  "supplier": {
    "party_id": "fixture:supplier:de-001",
    "display_name": "Synthetic German Supplier",
    "seller_country_code": "DE"
  },
  "product": {
    "name": "Reusable shipping tote, 600 x 400 mm (synthetic fixture)",
    "supplier_sku": "FIXTURE-TOTE-10",
    "category": "returnable-packaging",
    "specification": "Stackable reusable tote; specifications are illustrative only.",
    "identifiers": [],
    "pack": {
      "order_unit_code": "case",
      "units_per_pack": "10",
      "each_unit_code": "tote",
      "each_quantity": "1",
      "each_quantity_unit_code": "tote"
    },
    "substitution_policy": "none_without_consent"
  },
  "terms": {
    "unit_price": {
      "amount": "42.50",
      "currency": "EUR",
      "per_quantity": "1",
      "per_unit_code": "case"
    },
    "price_breaks": [],
    "minimum_order_quantity": "5",
    "tax_treatment": "unknown",
    "tax_description": "Not reviewed; no VAT treatment is implied by this fixture.",
    "payment_terms": "Synthetic fixture only; no payment terms offered.",
    "return_warranty_terms": "Not specified; synthetic fixture only.",
    "charges": [
      {
        "kind": "freight",
        "value": "unknown",
        "currency": "EUR",
        "basis": "per_order",
        "payable_by": "buyer"
      },
      {
        "kind": "duty",
        "value": "unknown",
        "currency": "EUR",
        "basis": "conditional",
        "payable_by": "unknown",
        "condition": "Check jurisdiction pack and origin/destination before a cross-border transaction."
      }
    ],
    "rebate_policy_ref": ""
  },
  "availability": {
    "status": "unknown",
    "quantity": "unknown",
    "observed_at": "2026-10-09T00:00:00Z"
  },
  "fulfillment": {
    "methods": [
      "delivery",
      "carrier"
    ],
    "available_country_codes": [
      "DE",
      "NL"
    ],
    "origin_country_code": "DE",
    "cross_border_supported": true,
    "shipping_terms": "Cross-border example only; no import/export, VAT, or delivery capability is implied."
  },
  "jurisdiction": {
    "required_profile_refs": [
      "EU:commerce:proposed-v0",
      "DE:commerce:proposed-v0",
      "NL:commerce:proposed-v0"
    ],
    "transaction_mode": "cross_border",
    "additional_local_requirements": [
      "All referenced profiles are illustrative and unreviewed."
    ]
  },
  "validity": {
    "created_at": "2026-10-09T00:00:00Z",
    "valid_from": "2026-10-09T00:00:00Z",
    "expires_at": "2026-12-31T23:59:59Z"
  },
  "evidence": {
    "source_type": "manual_entry",
    "source_reference": "fixture:synthetic-offer-eur",
    "captured_at": "2026-10-09T00:00:00Z",
    "asserted_by": "fixture:author",
    "verification_level": "unverified",
    "limitations": [
      "Synthetic fixture; no real supplier, price, stock, tax, or delivery claim."
    ]
  },
  "limitations": [
    "Not a purchasable offer.",
    "Cross-border availability and charges are not established.",
    "A currency/country code pattern is not validation against the live official code lists."
  ]
}
